,title,body
0,"I took HGH starting in 5th grade, stopped in 9th. We think my growth spurt during that period is because of the shot, but we’re not sure. My worry is, did my body grow dependent on it? Because I haven’t seen much puberty/growth since",
1,"""Normal"" androgens - hyperandrogenic symptoms","DHEA-S 237,50 ug/dl
Androstenedione 3,13 ng/ml
Testosterone 61,17 ng/dl 
i also have a DHT test from a few months ago at 
2258,1 pg/ml


I have really bad acne, oily skin, mild facial hair growth, and had puberty at 8. Glucose test came back at 90 mg/dl, which i'd assume makes pcos less likely?"
2,I have Growth hormone Deficiency. AMA,"It can be scary dealing with this issue because I've faced it alone for many years, if you need help with anything just ask :)"
3,Enclomiphene for Testosterone,"There’s an updated version of the drug clomid called Enclomiphene which is a single isomer of the original drug. It works by antagonizing estrogen receptors in the pituitary gland inhibiting estrogen negative feedback and raising gonadotropin hormone that raises testosterone. 

Great, and it certainly does because my testes balloon up, and I can def feel the increase in strength and muscle mass. The part that’s strange is that it feels emotionally very different than trt.. in that I feel emotionally blunted not apathetic but just an overall numbness my nerves are calm, I feel much more grounded and calm and collected whereas trt or even naturally I’d be more social and active.. I wonder if antagonizing estrogen receptors causes this? 

Estrogen is correlated with serotonin, could it be effecting this? Any endo experts or people with experience?"
4,Desperate,"Been going to all types of specialists since youth for stomach pain, nausea, fatigue, sleep issues, temrepture regulation issues, anxiety, depression, irritability, joint pain.

Been officially diagnosed with GAD, depression, autism, adhd, fibromyalgia, anaemia (same as my mum we both don’t get b12 from food and need injections) and hypermobility syndrome. Three different adhd meds made me feel even worse (palpitations, confusion, shaky ness and chest spasms recently) so my private clinical psychiatrist said he would refer me to an endocrinologist. Then, as before, he didn’t put in the report what he said he would. 

I am so desperate to not be in pain or feel sick anymore I don’t want to be alive just want to not hurt my family, please help me"
5,"18 male - 5’4. Still got 2-3 years growth. Do I actually have to have a lack of HGH to have any kind of treatment? father: 5’11, Mother: 5’2","So I originally went to my GP who made me do a blood test to which the results were good in the sense that my body was perfectly healthy, but because of that he concluded my growth plates had closed and that treatment wasn’t possible. I searched online and I decided to get a private x-ray to see if my growth plates 100% had closed as this matter is extremely personal to me for so many years. 
The x-ray approved by two professionals concluded I still had 2-3 years growth left in me.
But it just seems like I’m not growing, I am so so so so slowly but that’s it! And I’m sorry but it’s extremely hard to accept as people often tell me to when I know that there is treatment out there. 
I tried for treatment when I was younger and I was put on some project but this kept on constantly getting delayed till they eventually cancelled the project for all patients and thus I got no where.
I haven’t been diagnosed with depression or anything but I’ve felt extremely down about this for as long as I can remember as there’s not a day that goes by where I don’t think about it. Sucks also when my younger sibling is taller and my older brother it 6’1 :(.

Do I take these results back to my GP or do I actually have to have a lack of HGH for any treatment to be possible?? Or is there any other treatment ? I’ll literally do anything

Any any help is hugely appreciated."
6,"31F with VERY low dhea-s04, androsten., estradiol, prog. & testosterone","All of those incredibly low, as in ""post-menopausal"" according to a chart that accompanied the results from my doctor.

I am a normal weight and I've had 2 children before a few years ago. My TSH hovers around 2.5 nobody will treat it i assume it's good enough. I am having repeated miscarriages now, but i still ovulate every month naturally on day 14 and get my period on day 28. I don't see how my hormones can be SO BAD and post-menopausal-seeming but i still ovulate and menstruate like clockwork. One thing that has changed in the past few years is that my skin is suddenly very wrinkly and seriously hangs off of my body now. Its like my fat is liquid rather than jello like it was when i was younger, and so my skin just ""pools"" when i sit or lay down. Some parts of my body seriously look like a 60 year old woman. This was not the case 3 years ago

My fertility specialist is treating this as some sort of PCOS variant (????!! What the dang heck?? I have no abnormal cysts) But i think I need to see a general endocrinologist and not a reproductive endo at this point, since its ALL of those hormones and maybe my whole adrenal system is messed up here. 

Can anyone give any insight?"
7,Prepping for an Endocrinology Course,"Hi all,

I'll be taking an Endocrinology course next semester, and my Physio is a bit rusty in general. What are some useful resources that you recommend for prepping for the course?"
8,"Not sure what's wrong with me. Can't handle food more than 150 calories at time without severe anxiety, restlessness.","I'm making this post because I'm desperate, and the wait times to see an endocrinologist where I live is 3+ months. I don't want to have to wait that long, because my problem is progressing every day. I've done hours and hours of research on this problem but literally can't find anything.

About 8 months ago I tried out the ketogenic diet. Was eating a very large amount of fat and protein (didn’t measure), and no carbs. After about a week I on it I started getting these like extremely uncomfortable rushes of energy if I ate too much fat, so I went off the diet. When I added carbs back into my diet again, I still would get the rushes if I ate more than a small amount, so I slowly introduced them back into my diet with very small portions and eventually I worked my way up and after a couple of weeks and then I’d say everything was 95% back to normal. Then I had a rough week, went on a bit of a food binge (junk food, candy, fast food, etc) and when I came off it and returned to my regular diet I noticed I was getting the energy rushes again, not only when eating fat but now they would happen regardless of what I ate. (or how much) I also noticed that if I ate more than a very small portion of food at a time (similar to when I went off keto) I’d start feeling extremely anxious, restless, and wired. That feeling is ongoing, will go on forever, if i leave it. It only is relieved when I eat a 100-150 cal portion (has to be at least 45 min after the last time I ate), which will make me feel relaxed and normal again. This has been happening for 8 months now. I could tell as soon as it started happening that it was putting an enormous amount of stress on my body. I thought blood sugar problems at first but I got fasting insulin bloodwork done and it was fine and I’m also in good shape psychically. The only thing I can say is that I am pretty sure it's somehow related to my adrenals.

This had literally been wreaking havoc on my health. Since this happened, it's been putting an enormous amount of stress on my body. It's causing me to get weaker by the day. At this point, I don't have the energy to leave the house, and walking up and down the stairs can make me really tired. I don't have proof this is the cause of that, however I was fine before this and since the exact day it started, I've been slowly getting worse.

Edit: I should also mention that I have a mood disorder (Cyclothymia). It might be possible that it's somehow related."
9,Advice to increase Testosterone (without steroids),"I had blood work done, posted here a while ago, My testosterone is low but not alarmingly so according to UK NHS to prescribe me any test boosters.. 

310pmol (free test)
14 nmol (serum test) 
All other bloods normal including estrogen

Due to two injury's I have been unable to exercise the past 12 months, next week is the first time I can exercise so hoping that in itself increases my T levels... Anything else you can recommend me ? I have heard ZMA suppliments can rise natural levels ? 

I want to stay away from steriods etc"
10,Friend (25F) with nonexistent sex drive and incredibly low T levels,"Hi r/endocrinology. I have a friend in distress. 

She has never in her life experienced any kind of sex drive, or sexual attraction, and classifies herself as a biromantic asexual.  
I have observed her and noticed she has the smoothest, most hairless skin I have ever saw. She told me she had never had even one pimple. I attach a blood hormone levels test she took a couple years back. As you can see, the T levels are, if I'm not mistaken, on the level of a pre-adolescent girl.  
Sexual stimulation, of any kind, but especially genital, is uncomfortable and doesn't give her any pleasure, at best.  
This causes her much stress and causes tension in romantic relationships, obviously.   
She told me her ovaries are pretty much in working order, if that's important.  
What could be the source of this? How can it be treated?   
She's not able to get a doctor's consult right now, so I'm asking you before doing anything else - including shelling out some cash myself to get her to a doc. She's really suffering, any answer may be helpful.

https://preview.redd.it/gys0l1u689v31.png?width=700&format=png&auto=webp&s=db033971e3f07718b02676372a0b70c311b66125"
11,Abnormally high estrone,"I am looking for any insight as to why I might have elevated estrone levels. I am a 36-year-old transgender woman who was assigned-male-at-birth. Before starting hormone replacement therapy earlier this week, my PCP did labs to determine my pre-HRT hormone levels. Most were consistent with a cisgender male, as expected, but my estrone was significantly elevated. I'm concerned now that estrone levels could continue to climb into dangerous levels now that I've begun HRT (but I am also very reluctant to stop now that I've begun, as transition is important for managing my gender dysphoria). I would like to determine what might be causing these elevated levels so that my HRT regimen can be better managed around this abnormality.

I spoke online with a doctor who specializes in transgender medicine who suggested that ""this is clearly some sort of disorder of sexual development"", but the exact nature of which is outside of his realm of expertise.

To the best of my knowledge, my estrogen levels have never been tested before. I did have my testosterone tested about 6 years ago and it was within normal male range (though I don't have the exact numbers available). I had that testing done because of some erectile dysfunction I was experiencing at the time (which seemed to resolve itself). I have been experiencing erectile dysfunction again recently, but that seems to coincide with starting finasteride (which has ED as a known possible side effect) to address male pattern baldness. I also wanted to bank sperm before beginning HRT, but found that my numbers were incredibly low: a count of 1.5 million and a motility of just 17%. Another possibly related factor to all of this is that I required surgery shortly after I was born for a hernia and undescended testicle. And, in case it helps, I'm 5'11"" tall and 241 lbs (actively working on losing weight through diet and exercise).

Here are my hormone levels (but please let me know if there are other values from my labs that may be useful):

* DHEA sulfate, 236.9 ug/dL
* Estradiol, 32.2 pg/mL
* Estrone, 180 pg/mL
* FSH, 5.7 mIU/mL
* LH, 5.83 mIU/mL
* Progesterone, 0.29 ng/mL
* Prolactin, 7.2 ng/mL
* Testosterone (total), 350 ng/dL
* Testosterone (free), 54%"
12,Need help. Found an old test result. Going to endocrinologist on the 3rd. High 17OH at 16 while on BC? Now 21.,
13,Low LH levels but normal FSH levels,My doctor said she'd never seen that happen before and said she'd email someone in gynaecology I asked if it could be to do with the pituitary gland or hypothalmus and she said absolutely not otherwise all my hormones would be affected. The only other one which is slightly low is SHBG. Anyone had this happen/ know of the cause?
14,Lithium levels affect on thyroid (and dropping doses),"I'm curious if anyone knows what effect lowering lithium will have on my thyroid, or levels.  I was on 1200mg of lithium, it's being lowered to 1050mg.  I've been on it for 15 years, and also on alternating doses of levothyroxine for most of that time.  Right now I'm stable (I've had issues before) at 2.5 TSH.  Any worry that this would all push me into being hyperthyroid (this my chief concern, really, as I've had it happen before and it wasn't pleasant). Thank you!"
15,What's the consesus about steroid users practice of PCT-ing?,"I am just curious and I am not a user myself, but it seems like there is not much scientific literature on the subject.

After utilizing exogenous testosterone, steroid users will often run a Post Cycle Therapy (take clomid/nolvadex).

Does this have any backing by endocrinology? From what I've read, doctors will usually tell the users to quit taking anything and let the body do the job of recovering by itself. This is in stark contrast to what anabolic abusers believe.

My questions are:

\- Is it true that if one wouldn't do a PCT, they will possibly recover worse than if they did take these medications?

\- Is it actually more beneficient to take the PCT drugs as opposed to quitting cold turkey?

\- How long does it take for the body to start LH/FSH production after cessation of a long testosterone ester (such as Enanthate?)

\- How long does it take testicles to start responding to the raised LH/FSH levels?

What's the best practice for patients who need to discontinue a long-term TRT programme? Are they told to just quit cold turkey or is medicine being administered?

Is taking the SERMs just delaying the inevitable crash? (meaning that they help on short term, besides the nasty side effects, but then the body will hit rock botton anyway after discontinouing it?)

I was unable to find any reputable sources that could answer the questions and it's amazing how much broscience exists around the subject."
16,I am a 15 year old teenage boy and still haven’t begun puberty what should do?,"I am 15 and only 5,0 and 110 pounds a sophomore in hs I’ve had no signs of puberty once so ever my genital size has not grown etc etc I am getting worried even though my parents tell me they were both late bloomers."
17,"I am considering giving my 9 year old son, who is very short for his age, growth hormone therapy. But I am concerned because he is not GH-deficient, and I have read that there are risks involved with giving GH injections to children who are not GH deficient. Would appreciate any feedback.","I am 5'9"". My wife is 5'2"". Our 9 year old son is very short for his age (3'11""). He has been tested, and his GH level is normal, and his bone age is 7.5 years. We have been told by two separate doctors that he is trending toward the 5'0-5'2 territory in height.

We also have a 12 year old son who was short for his age at 9 (though not quite as short as his brother). The older boy has caught up to his classmates, and is now average in height.  But we have seen no growth spurt from our younger son, and we are concerned. We have seen two endocrinologists, both of whom specialize in children, and both recommend starting the 9 year old on Humatrope growth hormones.  

HOWEVER, the 9 year old has normal levels of GH in his system. And we have read that for kids who have ISS (idiopathic short stature), but who do NOT have a GH deficiency, giving growth hormone injections can carry serious risks such as diabetes, osteoporosis, increased risk of stroke, and an enlarged heart. 

When I raised these concerns with the doctor, he said that it was nothing to be concerned about, and that growth hormone injections are ""additive, not cumulative."" meaning that my son's body would naturally shut down its own GH creation once the injections were administered, and there would not be any issue with a surplus of GH in his system (I am paraphrasing what he said so I may not have it verbatim, but that was the gist of it).  

With a push from the doctor, our insurance company has agreed to pay for the GH injections. Using the [Open Payments Data tool](https://openpaymentsdata.cms.gov/), I have learned that both of my son's endocrinologists have received $50,000 in ""consulting fees"" from big pharma companies. That sounds bad, but is it? He is a specialist, and he does, I assume, ""consult"" with these companies. Or should I see that as proof that he just prescribes treatments that could be risky because it is profitable to him?  

Additionally, I have read reports that state kids who receive GH injections, but are not low in natural GH to begin with, may experience a growth spurt over the first year, but that is simply ""borrowing"" future growth, and that [the final adult height of such kids may be not be changed much, if at all.](https://www.ncbi.nlm.nih.gov/pmc/articles/PMC5790327/)

>More recently, van Gool et al (79) have reported that high dose GH therapy in prepubertal children with ISS does not improve adult height, as it increases height gain during treatment but, at the same time, accelerates bone maturation, resulting in a similar adult height compared with the untreated controls.

My wife is worried that my son will be extremely short as an adult, and this will negatively impact every aspect of his life, socially, professionally, etc. So she very much wants to start him on the GH treatments immediately. I am also concerned about the negative effects of his being extremely short, but I am reluctant to use GH treatments given the fact that his body is not GH-deficient. Any advice that we could receive would be most appreciated. Thank you!"
18,Inaccuracies in pituitary blood tests?,"Inaccuracies in pituitary blood tests?

An endo said to me to perform an insulin tolerance test as regular bloods could prove unreliable.

My concern is levels of T3 which showed up fine in regular bloods, but I can't get the specific figure for the insulin test.

Is T3 an actual pituitary related hormone vs TSH/ T4 etc?

Cause I know it's the product of metabolized T4.

Would an insulin stress test be used to test for T3?"
19,MRI today to look at Pituitary,"I've had symptoms of depression, anxiety, brain fog (I think), low libido, ED, weight gain/no weight loss even though I cycle daily and eat all healthy home-cooked meals. My GF says I've gotten irritable and moody lately too. I've had blood tests, and got these results.  

I also have a ton of other results too, but I think these are most relatable? Wish me luck, I've got a follow up in 2 weeks!

https://preview.redd.it/xkgbm4t1zxr31.png?width=441&format=png&auto=webp&s=399c81e8f30336f23803ffac42fc25eb87a53fda"
20,Thyroid Agenesis // low T-cells,"My 6 year old son (who is generally doing well at the moment) was born without a thyroid. We also found by about a year old that he has chronic low lymphocytes.  It seems to affect the way his body fights certain viruses. We’ve battled HSV-1 cold sores weekly/monthly and even eczema herpeticum. Thankfully his super sever eczema is generally under control, but cold sores are still an issue, especially when he gets sick. 

Anyway, the Endo doesn’t know how the thyroid could be related to his immune system directly and his immunologist doesn’t know of a direct correlation either, as the cellular immune deficiency and congenital hypothyroidism aren’t usually comorbid. 

Any chance when his thyroid was failing to develop, his thymus development might have had some issues too? I’ve asked all his docs but no one seems to know enough to give a solid answer. 

His CD4/CD8 ratio bobbles just above 1. Thankfully never dipping below as the doc said that’s when he would be more worried. 

Happy to share more if you have insights and want further details."
21,Best endocrinologist in Hyderabad,"Overweight and obesity are defined as abnormal. While diet and exercise alone may not be enough to
cure obesity, you will require weight management programs or treatments to improve your health.
Regular exercise, following a structured health plan and controlling stress and body hormones.
Magnacode healthcare center offers a comprehensive weight management program wi th obesity. Safe &
Effective Weight Loss Treatment is provided to help adult patients achieve and maintain weight loss. The
main goal is to help you adopt and maintain a healthy lifestyle that keeps you away from diseases and
health disorders.

The Weight Management program includes:
● Initially daily sessions in the first week followed by weekly learning sessions
● Adjustments to diabetes medications to enhance weight reduction
● A diet chart and meal replacement plans
● Individualized exercise plan including Aerobics and Yoga."
22,"No PCOS, no thyroid issues, but elevated DHEA-S with seemingly no cause...what now?","Gonna try to make a long story short. A little over a year ago my hair started falling out at a pretty alarming rate. Around this time I also developed anxiety for seemingly no reason (never had anxiety prior), became super lethargic, foggy, having trouble focusing, don't have the best memory, trouble sleeping, and irritable. I went to a general practitioner and she ran blood tests, but everything looked fine and she said it was probably stress. At the time I did have some stress due to taking a job, and moving to a new city for it, that turned out to be a big mistake. Still, I didn't think that was quite it, and the hair loss was causing me major stress and anxiety (still don't know if the stress/anxiety are a cause of the hair loss, or the hair loss is causing the stress/anxiety).  I went to a dermatologist who was basically in the room for about 30 seconds, took a quick look at my hair and had me take a blood test to check my ferritin levels. That was within normal range, but on the lower end so she prescribed iron. After months that had done nothing for the hair loss, or any other symptom. 

Fast forward about 8 months, to July of this year. I'm still having all of the above symptoms, and I also have some minor hair growth where I shouldn't - definitely have to wax my happy trail on my stomach and I have a few aggressive hairs on my chin and upper lip. I went to a new OBGYN for an annual, but also told him about my symptoms. He wanted to rule out PCOS, so we did blood tests and an ultrasound. I have a polyp in my uterus, but no ovarian cysts. Only thing on the blood tests that were abnormal was my DHEA-S. It was 583. My OBGYN said above  270 µg/dL was out of range. Since it was so high, he had me do another blood test after fasting. This one had gone down, but was 380. He could tell that I was still freaking out about losing my hair, and he said that elevated DHEA-S can cause male pattern hair loss in women (which is the type I appear to have, based on how I'm losing it), so he referred me to an endocrinologist. She ran more blood tests to check my testosterone and some other stuff, as well as the DHEA-S, and had me do a thyroid ultrasound because she thought she felt a nodule on my thyroid. She said she'd take a look at the tests and I could consider birth control or spironolactone, but said my hair growth isn't that bad so I probably wouldn't need that. I had read many times that spiro could be used to help regrow hair on your head when you have high DHEA-S, so I thought that's what she meant. She corrected me, saying it doesn't help regrow lost hair but helps decrease unwanted hair in women (like lip, face, etc.). Anyway, a week later the nurse practitioner called me and said the ultrasound was negative, all blood tests were normal, but DHEA-S was still elevated, this time at 439. I inquired about that spiro stuff and she said my levels weren't \*that\* high and I don't have PCOS, so I didn't need it. She told me I don't need to see them any more and to just follow up with my OBGYN. No advice, no answers, no direction. Pointless. 

So, here I am. No real answers, and more questions about this elevated DHEA-S, and still going fucking bald. Based on the loss over the last year, I'm pretty terrified as to what it's going to look like in another year. Not to mention all these other weird symptoms I've been having that are definitely out of character. I don't know what I should do now - should I get a second opinion from a different endocrinologist? I wasn't really a fan of the one I went to, and soon I'll be getting insurance through my job and can ditch the shit, bottom of the barrel HMO that I currently have. Any advice on next steps would be greatly appreciated. Also, I failed at not making this too long."
23,"Pituitary microadenoma with prolactin, corticotropic and thyreotropic deficiency: from infertility to pregnancy : About a case",
