,title,body
177,Lost secondary sex characteristics with onset of menopause,"56F here. About 4 years ago I developed chronic widespread tendon pain, brain fog, exhaustion and weight gain. This occurred within a couple years of the onset of menopause and was a sudden onset.  I have a history of anxiety and depression but was doing well prior to menopause, around which time my anxiety shot through the roof for no apparent reason. I can’t say that coincided exactly with menopause which is such a gradual process. 

My tentative diagnosis for the chronic pain and malaise is lupus yet I am negative on every test except low C3/C4, and no treatments for lupus have helped.  Not even prednisone. I stopped the prednisone a very long time ago.  

Both parents had hypothyroidism but my TSH and T4 are normal. 

I recently saw an Integrative Medicine specialist who suggested the cause of my symptoms could be hormonal. I should point out that my weight gain in 4 years is 25 pounds, most of that in the first year. All my pubic and armpit hair fell out, as well as eyebrows. I no longer have B. O.  and do not need to use antiperspirant. I have no libido. This is despite being on HRT: Prempro 0.625 mg, plus Estring low dose vaginal ring for vaginal atrophy and urinary incontinence. I have developed an abdominal body fat pattern. 

A couple months ago I started DHEA and my pubic hair is growing back but still no libido, BO, or eyebrows. 

My PCP thinks I am on the proper level of HRT but I still don’t feel like myself.  She didn’t think I needed to see an endocrinologist. 

But do I need to see one? And what could be going on with me?

Signed,
I miss my stinky armpits and I want my eyebrows and body back. "
178,Penis sensitivity/ libido and hormones,"Hey guys, for some time now my morning erections ar non existant, penis sensitive down, it even shrunk a little and my balls ache? I think its due hormones, wich tests should I do? "
179,My feelings for my boyfriend change DRASTICALLY throughout my cycle. What is this??,"&#x200B;

(Please refer to the image of my graph that I made below) I have been dealing with this for the past almost 11 months now, and I don't know how much longer I can deal with this for, so any possible pointers as to what this is or how to fix it would be appreciated. (Nothing like ""oh maybe he's not right for you...""- like actual medical answers please) But it all started when I was in the most amazing long distance relationship for two months prior to this, I was insanely infatuated with him, and it was the most exciting thing ever. But on the other hand, I was getting very little sleep, and under a lot of stress. Which is what may have triggered it. Plus, my hormones were going crazy from this new excitement, I assume. But then one day at the end of March, a few days before I started my period, I suddenly lost feelings for him. I assumed it was just my period, and I thought I was right, because a few days later I felt strongly for him again (yet not as strongly as I did before it dropped- and haven't nearly felt the same way since). But the for the past almost 11 months, it seems to have the same pattern- the way I feel towards my boyfriend drops significantly right before my period begins, then after about 5 days I start to feel strongly for him again, and then about 5 days later, right between my periods, or perhaps during ovulation, the way I feel for my boyfriend and how attractive I find him drops drastically, lasts for 5 days, and then rises again for another 5 days, and drops right before my period starts. I hate feeling so negative about my boyfriend, as it is when it goes down, and I really want to find out what this is so I can put an end to it. It is honestly torture when it drops, and when it rises again I wish it were to stay that way, but it never does. But when it is low I don't want to look at pictures of my boyfriend, and I can't even imagine us together in person, and I constantly get negative thoughts about him or the way he looks, and every little thing will bother me about him when it is low. I had to break up with him because of this, because it is torture. I am wondering if this is a hormonal imbalance? Is this an estrogen imbalance? A progesterone deficiency? Oxytocin imbalance? Some kind of mental imbalance? Is this even related to hormones or my cycle? Any help is appreciated. Thank you!!

https://preview.redd.it/13qchqkl1og21.jpg?width=3264&format=pjpg&auto=webp&s=7bd34ba0df23aaba03d9fe6696c16c12979ef955"
180,Nicotine affect on thyroid? TSH lowering after a week of quitting... can it reverse itself?,"Hello, I quit smoking a week ago after what was a short stint of smoking that drove my TSH down from a usual 1.4 to .6,   So in a month, 3 weeks of smoking and then a week of being quit, my TSH seems to keep going down and a now its a .37..  I'm wondering if there is just a time period that I have to wait after quitting that it should reverse itself?  I thought that it might correct itself but maybe I'm not being patient enough.  I'm waiting on FT4 and FT3, but for now I'm just hoping I don't go hyperthyroid again.  I had vaped before, and went hyperthyroid, so for whatever reason maybe I have an issue with nicotine.  Thank you for any help you can give, and I know my question might not be spot on, but I can answer any questions.  Thank you!"
181,Long Term Safety of Melatonin ?,"32 year old male here, with a height of 6 foot(180cm) and weighing at 180lb(82kg).

I have had a history of having difficulty in falling asleep and was suggested to try melatonin. I have been using it for nearly 6 months now on a regular basis. Recently I did a little bit of searching online and it seems like the long term safety of melatonin is unknown. Some research papers claim its an antioxidant and what not but I am more concerned about its safety and was wondering if anyone from the medical community could provide an unbiased opinion on melatonin

Highly appreciate it any feedback here. Many thanks in advance.

"
182,Hypothyroid symptoms after running marathon,"From the time i was 13 i have always been the same weight. 135- 142 pounds. No matter what i ate or didn’t eat, how fit or unfit i was i was always in that range.

When i was 24 i decided to run my first full marathon. I felt healthy and great for the majority of my training. I was in the best shape of my life. 

Midway through my training i stopped taking birth control pills and lost my period until 3 months after the marathon. I hadn’t lost any weight so i assumed everything was ok.

At the time i was following a lower calorie meal plan in attempt to tone myself a bit more. Looking back i realize i probably should have been eating more for the amount i was burning.

After completing my race i gained 20 pounds within the month. Still eating healthy and training 5-6 times a week. I was constantly fatigued, had brain fog, and the driest skin possible.  within another month i gained another 10 pounds. 

I saw a doctor and was put on unithyroid for ‘minor hypothyroidism”. When that didn’t yield any results i was told to start on the pill again to fix any hormonal imbalances.

It's been 3 years since and i have not been able to lose any weight. I’m not in an unhealthy range but i'm heavier than i would like to be. My TSH has gone from slightly high to super low (.03 at one point). I never regained the energy i once had. My doctor still keeps me on the unithyroid.

Does anyone have any idea what happened?"
183,Found a lesion on my adrenal gland....totally confused..,"47 year old female here. Was in great health. Then started to have zero energy. Noticed my lower legs below my knees to my ankles were swollen and red. And at the end of the day dead tired felt like my mucles in my lower legs were literally trying to separate from all things that they attatch to. And my skin literally hurt. Almost like someone had kept rubbing in the same spot for hours! Sore as hell. Couldn't massage the pain away infact any kind of pressure hurt.

I decided to go see my G.P. but where i'm from it's all nurse practitioners who work at a clinic under one doctor. Anyways my nurse practitioner is a tree hugging,retreat taking,bring back new cumbia type of medicine. I find her to be a straight fruit cake. 

I go see her about my rapid weight gain due to no changes in diet as well as swelling of legs. And zero energy She wanted me to see a nutritionist and why don't i try chewing a raisin mindfully. Chew it at least 20x's. Think where did it come from. Notice the taste. Make a fucking production out of eating a raisin. Super out there. I think she thought i was there cause i feel fat. I don't even know. She wasn't even listening to my symptoms.

I actually went to her cause i was feeling so shitty and exhausted. I needed a referal to get a cat scan. I had remembered about 20 years ago at an emergency appendix surgery they had done a scan and found this adrenal lesion. They told me then to follow up. But i had small kids and life moved so fast i never thought about it untill now. 

I went on line and from what i read about my symptoms it pointed to an adrenal issue. Then i rembered about the 20 years ago adrenal lesion. All the things i read pointed to that might be the problem. I went to see my doctor. 

She reluctantly gave the order. Guess what came back the adrenal lesion. But when i went back for follow up i asked for a diffrent  N.P.  i really  am feeling like shit. 

The new N.P orders bood work. Gets it back says all looks good. But from what i've read that can happen. I asked to see an endocrinologist. I needed answers. 

I got the referal waited 2 months saw him yesterday and he was great. He was very attentive to my issues. He looked up my test and said he didnt think this lesion was a big thing but to be on the safe side cause he never assumed anything. He also ordered test more thorough tests that the "" normal  standard test "" don't pick up. 

He promised he would help me find answers as to why i feel so bad. He had said alot of doctors miss diagnose anything to do with the adrenal glands and he doesn't want to miss anything. 

I can't wait to feel normal again. I'm sick of when i wake up feeling like i hasn't slept. And all this pain my body is feeling. I ckearly have a hormonal thing going on. I need to know what this is and fix it. I can't stand having no answers and feeling like shit. Plese let this be a step in the right direction. 



"
184,Maximizing Successful Implantation (for pregnancy) in Females without Exogenous Progesterone,"Hi, I was wondering if anyone had any idea as to how females with a history of miscarriages can potentially increase their chances of a successful implantation by modifying internal progesterone activity/levels (**without exogenous progesterone supplementation**). Any ideas? Thank you!"
185,Giving my future kids growth hormone before growth plates close,"I'm a male barely 5'0"", and my fiance is barely taller than I am. Life has been incredibly difficult at this height, and when I have kids, especially if they're boys, if there is anything that can be done to prevent them having the same issues, I will do it. This is 

I've been thinking this: if I give the kids growth hormone as they're hitting puberty but before the growth plates fuse, would that help them reach a taller height? Would I risk harming them? How might it be done if it won't harm them?"
186,May I take cyproterone acetate with milk?,"I know some meds can't be taken with milk but I'm not sure if cyproterone acetate is one of them and it's also extracted from breast milk.

I will also start taking vitamin pills (which also has calcium). May I take them together or should I wait sometime after taking cypro?

Thanks."
187,27 male - DHEA-S (blood serum) deficiency since years,"Hello

Im 27 years old and my blood serum results show always dhea def since years . 

The result from yesterday showed that i have dhea-s 206 (280-680). Every result was in that low area .

Months ago a few redditors told me to reduce stress and not to take dhea cuz it will increase naturally. Im honest i have no stress at all jobwise or unhealthy food habits or whatever . Everythinf is ok.

Only thing is i have depression since over 10 years and i suppose obsessive negative thinking increased my stress levels so much till dhea got less and less. Now i dont have ocd anymore

Isnt it the best to take dhea under professional help . And could i expect depression lift if dhea will be increased?  I really hope it would lift."
188,Low T at 18. Growth catchup?,"I was recently blood tested with a testosterone of 240. I have very very little facial hair. I have an ample amount of armpit hair. I’m about 5’5 110 pounds with very little muscle. My penis is 6 inches hard 5 inches girth. Is growth catchup possible with testosterone? Particularly is genital area? Men in my family seem much larger, especially flaccid. Men in my family stopped growing in their 20s."
189,Normal TSH and low-normal ft4,"Hi everyone!

&#x200B;

I tested my thyroid thoroughly the first time 2016, I was 25 then. It's in german but summarized it says that there are no antibodies against the thyroid and fT4 is 10.6 pmol/l. I already then wondered if there is something strange going on with the low thyroxine but the doctors assured that everything is fine. Well another three wasted years went on..

I have a lot of different symptoms, I'm in  psychiatric treatment since childhool with depression, anxiety, add-like symptoms (sluggishness, forgetfulness,brainfog) etc. I have got a lot of different body-symptoms also. I let my thyroid test again last week and my **TSH was 1.58 and my ft4 10.2**. I'm just wondering if it was possible that there could be an relationship between all the symptoms and my thyroid or pituitary?

If I compare my TSH to the values of this article [https://academic.oup.com/jcem/article/98/7/2936/2537137](https://academic.oup.com/jcem/article/98/7/2936/2537137) then are mine suspiciously low. According to the equation my TSH should be higher -> median is  about 4.8 (with this low fT4)...

https://preview.redd.it/z8vwuw5v4re21.png?width=610&format=png&auto=webp&s=552b99f09ab2f6c5ce1cad8a521291b0100c090e

&#x200B;

&#x200B;

https://preview.redd.it/d5p04xdduqe21.png?width=1283&format=png&auto=webp&s=d6c5db9fd9469ca2c5d90979f3650253acf0ee3e"
190,Whаt lеvеl wоuld уоu nееd tо sеt уоur еstrоgеn lеvеls tо nоtісеаblу dеlау ерірhуsеаl саrtіlаgе fusіоn?,"Sorry if this is the wrong sub but this is something I've been curious about and couldn't find any concrete answer. Lеts sау уоu tооk а lоw dоsе оf Aromatase inhibitor tо аvоіd рuttіng уоur Е lеvеls tоо lоw, sо аs tо аvоіd оr rеduсе thе sіdе еffесts of low E, wоuld thіs stіll bе еffесtіvе tо nоtісеаblу dеlау ерірhуsеаl саrtіlаgе fusіоn? оr wоuld уоu nееd tо рut уоur еstrоgеn lеvеls vеrу lоw (аnd suffеr аll thе sіdе еffесts) tо mаkе а nоtісеаblе dіffеrеnсе?"
191,High HGH,"19F 5'5 110 lb

If I have high HGH, and on-and-off facial swelling since I was 13, but no tumor in my brain then what could be the cause of it?"
192,Hate appointments,"I have bpd, hyperthyroidism and I'm a diabetic. Daily I have high sugars that could get to 20-25. Its pretty high. I have missed my last two endocrinologists appointments and this is my third. Just nervous is all. Hope it goes ok."
193,Exercise while hyperthyroid,"33 yo F, history of papillary thyroid cancer with a total thyroidectomy in 2007, on maintenance levothyroxine. Normally pretty active (bike 5x/wk, swim 2-3x/wk, pilates or yoga 1x/wk) and am otherwise healthy with no other medical problems.

Last week my TSH was low (0.018, with a normal T4) and I’d been feeling jittery, so we decreased levothyroxine and will recheck TSH in 6 weeks. 

My endocrinologist recommended I “take it easy [on exercise] for a few weeks until the TSH normalizes.” So I’ve taken the past week off of all exercise (except walking) and I’m wondering how and when it will be OK for me to start again, since the recommendation he gave was pretty vague.

I had very low (undetectable) TSH in the past (years ago), and this is the first time I’ve been told not to exercise. I understand that the risk would be arrhythmia or (more chronically) heart failure, but I’m also a bit confused bc even if the TSH takes weeks to normalize, my level of thyroid hormone should immediately adjust (since I have no thyroid tissue left, the only hormone is what I take in the pill). I can’t tell if my endo is just being conservative, or if I really need to not work out for 4-6 wks(!!!!).

- Has your endocrinologist recommended exercise precautions for medication-caused hyperthyroidism?

- If so, did they give specific guidance on what kind of exercise is OK/not OK? (yoga vs cardio vs strength training...) And/or how long exercise should be limited?

Obviously I am going to ask my doc for clarification, but was curious to hear if others had similar experiences.

Thanks! 

(X-posted to askdoctors)"
194,Academic question; Is my testosterone the same as your testosterone?,"To explain what I mean; is testosterone or other hormones completely uniform person to person? Or is their any diversity between say the testosterone in a typical Male and one who is a repeated sex offender? 

So I guess I’m asking if their is any difference between testosterone molecule A from person A and testosterone molecule B from person B? 

My background is psychology and philosophy so I’ll apologise if this comes off as a stupid question."
195,ds,
196,Can the body produce estrogen directly without aromatase?,"Can the body, or a tumor, produce estradiol, or estrone, directly without using the aromatase enzyme pathway? Everything I've read says that the only way to make estradiol is via aromatase:

1. Androstenedione is converted to estrone by aromatase, and then estrone is converted to estradiol via 17β-HSD.
2. Testosterone is converted directly to estradiol by aromatase.

[https://en.wikipedia.org/wiki/Estradiol#/media/File:Steroidogenesis.svg](https://en.wikipedia.org/wiki/Estradiol#/media/File:Steroidogenesis.svg)

&#x200B;

My body is producing way too much estradiol and I don't know why. My labs from last week showed an estradiol level of 118 pg/mL, a testosterone level of 190 ng/dL, and a LH level of 6.5 mIU/mL. Previous labs from 2011 showed an estradiol level of 34 pg/mL, a testosterone level of 179 ng/dL, and a LH level of 5.7 mIU/mL. This is a 347% increase in estradiol level.

&#x200B;

Since my previous estradiol level was normal that pretty much rules out Aromatase Excess Syndrome because I don't think acquired AES is possible. I've check all my medications for possible interactions with aromatase or estrogen and can't find anything. The only thing that appears to be left on the table still is an estrogen secreting tumor.

&#x200B;

However, that doesn't appear to add up ether, because if aromatase is responsible for the biosynthesis of all estrogens then it would seem to make reasonable sense to presume that my testosterone level would also be elevated in relation to the first and second set of lab tests. Because:

1. Androstenediol is converted via 3β-HSD to testosterone, and then testosterone is converted via aromatase to estradiol.
2. Androstenedione is converted via aromatase to estrone and then estrone is converted via 17β-HSD to estradiol.
3. Androstenedione is converted via 17β-HSD to testosterone, and then testosterone is converted via aromatase to estradiol.

In all three of those chemical conversions it takes less steps to create testosterone then it does estradiol, thus therefor there should be more testosterone. However, the TT/E2 ratio for the two sets of lab tests is 1.6 and 5.26 respectively, this is a 327% change.

&#x200B;

All of the excess estradiol only seems to make sense if there is a tumor that has a mutated copy of the aromatase CYP19 gene that is operating in AES mode. Another theory is that aromatase is being unregulated. What regulates aromatase?"
197,Estrogen/Progesterone statistics?,"I'm just curious, what are the average amounts of estrogen and progesterone in:

* A cis woman who is of reproductive age and not on birth control pills or HRT.
* A woman who is on birth control pills.
* A woman who is pregnant.
* A trans woman who is on HRT.  "
198,Does a prolactin level of 127.0 ng/mL warrant an MRI/treatment?,"42 years old.  5'7'' - 185 to 190.  I know I'm fat, I'm down from 199 and lift 3 times a week.  Still working on this.

&#x200B;

I noticed about nine months ago that I was starting to have issues with my lifting, weight loss stalled and some ED.  Basically my strength was just gone and I felt like a black and white copy of myself.  So I went and had a testosterone test done which came back with:

&#x200B;

Testosterone, Serum	160 Low	ng/dL	264 - 916

&#x200B;

This led me to see a urologist and he ordered some additional blood work.

&#x200B;

LH 1.8 mIU/mL	0.6 - 12.1 mIU/mL

Testosterone 187 ng/dL	180 - 680 ng/dL The bottom range seems really low to me? Different age range?

Prolactin 127.0 ng/mL	2.8 - 15.6 ng/mL

&#x200B;

The number here that really jumps out at me is the prolactin value.  I'm meeting with my urologist again tomorrow for a follow up but was just curious what I should be expecting.  Does a value like this warrant an MRI and referral to an endocrinologist?  Will a urologist prescribe Cabergoline or other dopamine agonist in the interim ? 

&#x200B;

 "
199,Adrenal Crisis Time?,"Hey Everyone, 

Wondering if anyone who has experience with Addisons Disease noticed if a crisis or near crisis(not as severe as full blown) come about at certain times of day? (Specifically, in the early mornings between 3am-5am, when the cortisol slope is naturally at its lowest). 

Any insight if anyone has noticed crisis' happening more at this time before, or if a persons likelyhood with adrenal insuffciency having a crisis' when their natural diurnal cortisol slope would have been its lowest IS indeed something documented/reported would be very helpful! :) 

Thanks in advance for any replies!! "
200,How good of a predictor is body shape/shoulder width for stuff like Kleinfelter?,"Male,  28, never had interest in sex though I am attracted 100% to females.  From Madison Wisconsin. Sister has basically same weight and height (155  lbs, 5'11"") but has shoulders 20% larger (still in female average range  -mine are very narrow). Does my body shape look abnormal?

[https://imgur.com/a/MFpuzpX](https://imgur.com/a/MFpuzpX)"
201,16 year old boy here. endocrinology has recently peaked my interest and i think it might be what i want to do for a living in the future. can any endocrinologists answer some questions i have about the job?,
202,Normal aldosterone and Aldo/renin ratio. But renin direct is high. Help pls,"Like the title says my aldosterone is 17 and the ratio is normal around 1.

However my renin direct blood test came back 11.89 when it should be no higher than 5.9.

Should I be worried? Is this really high? I’ve had somewhat high blood pressure lately which is what triggered me to get tests.

32/male/slightly overweight (6’2. 235lbs)"
203,gf,
204,"I am sure there is something wrong in either my ovarians or bowels. But bloodwork show I don't have any thyroid problems. I am guessing I have some sort of endocrine disorders as before I have my first baby, my period comes every 40 days very regular but it's every 40 days.","been losing hair and seem cannot gain weight, however much I keep eating. dizzy, frequent urination, hard to focus, abdomen bloating, recent bowel movement change / more frequent of pooping. both ovarian cysts about 3*3*3 cm. delivered on July 2017. brestfed for 9 months, later on herbs for 5 months (FibroDefense as it shrank my fibroid for 85%) and fibroid HIFU(ablation) done on September 2018 and finally fibroid was gone. Should I see a endocrinologist or gastroenterologist? I called my ob and she said I had ultrasound recently on December 17th and I also had blood work done on December so ruling out on ovarian cancer. "
205,Could my estrogen be low?," I am 37 and have a 4 year old and a 2 year old. After the second kid we decided we didn’t want to have any more so my husband got fixed. I was experiencing anxiety so I talked with my doctor and she put me on Zoloft. It helped but it still seemed that the week before my period I would fall into a deep depression and was barely able to take care of my children. I spoke with my OBGYN to see if maybe getting on a birth control and skipping the placebo pills could possibly keep me from experiencing this every month. I have been on both pills for a year now and still struggle every few months. It always seems that when I feel the anxiety coming on I end up bleeding for a few days. I am taking YAZ but I was under the impression that when you are on birth control your body doesn’t ovulate so why am I bleeding? Especially if I don’t ever take the placebos and start a new pack the next day? I am very consistent with taking them the same time everyday. This is obviously hormonal and I want to get to the bottom of it so that I don’t have to go through this anymore. I know that I can’t be the only one that experiences this, right? "
206,Thyroid uptake scan results?,"I had received a thyroid uptake scan for hyperthyroidism. 

How bad is a result that is in between 75-85%? 

I was told normal results are from 8-30%. Thus my results seem to be quite high? 

Is the dosage of methimazole based on the results? For a patient whose result is between 75-85%, what would be the recommended dosage? "
207,Good Endocrinologist in Dubai ???,Any recommendations for good endocrinologist in Dubai? 
